{
  "id": "axis_auto_07",
  "topic": "Eixo â€” I/aVF",
  "difficulty": "easy",
  "stem": "Com I=-2 mV e aVF=3 mV, classifique o eixo:",
  "options": [
    "Normal",
    "Desvio para a esquerda",
    "Desvio para a direita",
    "Desvio extremo (noroeste)"
  ],
  "answer_index": 2,
  "explanation": "Quadrante aponta para desvio para a direita."
}