{
  "id": "cam_0013",
  "topic": "cameras_cardiacas",
  "difficulty": "medium",
  "stem": "Se DI mostra QRS positivo e aVF mostra QRS negativo, usando as câmeras, onde está o eixo?",
  "options": [
    "Entre 0° e +90° (eixo normal)",
    "Entre +90° e +180° (desvio para a direita)",
    "Entre -90° e 0° (desvio para a esquerda)",
    "Entre -180° e -90° (desvio extremo)"
  ],
  "answer_index": 2,
  "explanation": "A câmera DI (0°) vê o vetor se aproximando (QRS+) → vetor aponta para a esquerda. A câmera aVF (90°) vê o vetor fugindo (QRS−) → vetor aponta para cima. Combinando: esquerda + cima = entre -90° e 0° = desvio do eixo para a esquerda."
}
