{
  "id": "p2_auto_001",
  "topic": "Técnica — Baseline wander",
  "difficulty": "easy",
  "stem": "Causa comum de baseline wander:",
  "options": [
    "Respiração/posicionamento",
    "Digitálico",
    "Hipercalemia",
    "Marcapasso"
  ],
  "answer_index": 0,
  "explanation": "Respiração e contato."
}